url,Course Title,Course Headline,Instructor,Rating,course_length,number_of_lectures,difficulty
https://www.udemy.com/course/datastructurescncpp/,Mastering Data Structures & Algorithms using C and C++,"Learn, Analyse and Implement Data Structure using C and C++. Learn Recursion and Sorting.",Abdul Bari,4.6,58.5 total hours,390 lectures,All Levels
https://www.udemy.com/course/cpp-data-structures-algorithms-levelup-prateek-narang/,"Data Structures & Algorithms, Level-up Course(2021)",The only course you need to master problem solving using Data Structures & Algorithms in C++,"Prateek Narang, Coding Minutes",4.6,29.5 total hours,239 lectures,All Levels
https://www.udemy.com/course/cpp-data-structures-algorithms-prateek-narang/,Data Structures & Algorithms Essentials (2021),"Master the core concepts & internal workings of data structures, build algorithms & solve problems using C++","Prateek Narang, Coding Minutes",4.5,27 total hours,240 lectures,All Levels
https://www.udemy.com/course/data-structures-algorithms-using-c-zero-to-mastery/,Data Structure & Algorithm using C++ : Zero To Mastery 2021,"Greedy Algo, Dynamic Programming , Graph ,Tries , Arrays, Recursion, Linked Lists, Trees, HashMap, Stacks, Queues, Heaps","Ankit Thakran, Harsh Kajla",4.5,64.5 total hours,268 lectures,All Levels
https://www.udemy.com/course/algorithms-bootcamp-in-c/,Algorithms (Data Structures) Bootcamp in C++,"Recursion, Backtracking, Dynamic Programming, Graphs, Data Structures, Sorting and Substring Search Algorithms",Holczer Balazs,4.4,17 total hours,149 lectures,All Levels
https://www.udemy.com/course/coding-interview-question-data-structures-algorithm/,Cracking Coding Interview : Data Structure & Algorithms C++,100+ Leetcode problem solved in C++ (FAANG) Crack your next coding interview by mastering data structures and algorithm.,"Ankit Thakran, Harsh Kajla",4.5,48 total hours,202 lectures,All Levels
https://www.udemy.com/course/data-structures-and-algorithms-cplusplus-for-interviews/,Data Structures and Algorithms in C++ For Coding Interview,Covers Algorithmic Problems in C++ That range a variety of data structures which often pop up during a coding interview.,El Farouk Yasser,4.6,7 total hours,63 lectures,Beginner
https://www.udemy.com/course/mastering-data-structures-and-algorithms-using-c-programming/,"Data Structures & Algorithms using C++, C and Python - 2021","Coding Interview : Learn Arrays, Stacks, Queues, Linked Lists, Trees, Graphs & Algorithms from basics to advanced.",Atchyut Kumar,4.6,42.5 total hours,215 lectures,All Levels
https://www.udemy.com/course/data-structures-and-algorithms-in-c-algorithms-and-data-structures/,Data Structures and Algorithms using c++,"Concepts and coding of various data structures and algorithms like Trees, Linked List, Stack, Queue, Sorts and many more",Muhammad Hamza AbdulRehman,4.1,3.5 total hours,47 lectures,All Levels
https://www.udemy.com/course/c-plus-plus-programming/,Complete C++ Programming with Data Structures and Algorithms,"C++ Programming basics to Arrays, Strings, Pointers, Recursion, OOP's, Linked Lists, Stacks, Queues, Trees, Graphs ,DP",Kunal Gupta,4.4,56 total hours,240 lectures,All Levels
https://www.udemy.com/course/data-structures-and-algorithms-in-c-plus-plus/,Data Structures and Algorithms In C++ (DSA Coding Interview),Data Structures and Algorithms in C++ to Crack Coding Interview Using C++ Advanced Data Structures C Plus DSA LeetCode,Deepali Srivastava,4.2,11.5 total hours,148 lectures,All Levels
https://www.udemy.com/course/learn-basics-of-data-structures-algorithms/,Learn Basics of Data Structures & Algorithms in C++,Covers Types & Search Algorithms with implementation in C++ & Analysis of Complexity with Interview Based Questions,Mehak Mahajan,3.1,4 total hours,21 lectures,Beginner
https://www.udemy.com/course/algorithms-and-data-structures-in-c-coding-interview/,Algorithms and Data Structures in C++ (2020),"Learn Algorithms and Data structures in C++, get ready for enginnering interview",Luke's Programming School,2.9,2.5 total hours,38 lectures,All Levels
https://www.udemy.com/course/test-your-data-structures-and-algorithms-skills/,Data Structures and Algorithms ( DSA Interview Questions ),Data Structures and Algorithms Coding Interview Questions DSA Independent of using in C C++ Python Java JavaScript C#,Suresh Kumar Srivastava,3.5,177 questions,All Levels,All Levels
https://www.udemy.com/course/sorting-algorithms-from-beginner-to-expert/,Sorting Algorithms from Beginner to Expert,"Learning , Implementation in C++ and Analysing Sorting Algorithms in Data Structures",Mehak Mahajan,4.7,6 total hours,33 lectures,All Levels
https://www.udemy.com/course/c-programming-the-coding-interview/,C++ Programming: The Coding Interview,Ace your next C++ coding interview by mastering data structures and algorithms.,Programming Made Easy,4.1,2.5 total hours,28 lectures,Beginner
https://www.udemy.com/course/master-data-structures-algorithms-interview-using-c/,"Master Data Structures , Algorithms & Interview using C++","Learn about Arrays, Linked Lists, Trees,  Stacks, Queues, Heaps, Search data structure algorithms,Interview Preparation",Manik Soni,,13 total hours,72 lectures,All Levels
https://www.udemy.com/course/the-ultimate-c-plus-plus-interview-questions-bootcamp/,The Ultimate C++ Interview Questions Bootcamp,Data Structures + Algorithms to Crack the Coding Interview,"Mammoth Interactive, John Bura",3.3,7.5 total hours,52 lectures,Beginner
https://www.udemy.com/course/c-software-developer-interview-preparation/,C++ Software Developer Interview Preparation,"Prepare yourself for advanced C++, STL, data structures and algorithms interview questions",Tegaru Labs,3.7,265 questions,Intermediate,Beginner
https://www.udemy.com/course/stl-standard-template-library/,STL - Standard Template Library And DSA Interview Questions,Crash Course for STL - Standard Template Library in C++ and Data Structures and Algorithms,Anant Rungta,4.2,2.5 total hours,20 lectures,Beginner
https://www.udemy.com/course/fsmproject/,Coding Project - Programming Finite State Machines,"C/C++ Projects, Library Design, System Projects, Programming based Course, Data Structures and Algorithms, Automata, TOC","Abhishek CSEPracticals, Shiwani Nigam, Ekta Ekta",4.8,2 total hours,22 lectures,Intermediate
https://www.udemy.com/course/wheeltimers/,System C/C++ Course on Linux Timers Implementation & Design,"Data Structure & Algorithm to Schedule future events, Linux System Programming, Operating systems, C/C++ programming","Abhishek CSEPracticals, Shiwani Nigam, Ekta Ekta",4.7,4 total hours,42 lectures,Beginner
https://www.udemy.com/course/introduction-to-algorithms-and-data-structures-in-c/,Introduction to Algorithms and Data structures in C++,A step-by-step guide with solved problems. I'm teaching visually with lots of examples.,Andrei Margeloiu,4.4,3.5 total hours,39 lectures,Beginner
https://www.udemy.com/course/master-the-coding-interview-data-structures-algorithms/,Master the Coding Interview: Data Structures + Algorithms,"Ultimate coding interview bootcamp. Get more job offers, negotiate a raise: Everything you need to get the job you want!",Andrei Neagoie,4.7,19.5 total hours,259 lectures,All Levels
https://www.udemy.com/course/coding-interview-bootcamp-algorithms-and-data-structure/,The Coding Interview Bootcamp: Algorithms + Data Structures,Ace your next Javascript coding interview by mastering data structures and algorithms.,Stephen Grider,4.8,13 total hours,136 lectures,All Levels
https://www.udemy.com/course/js-algorithms-and-data-structures-masterclass/,JavaScript Algorithms and Data Structures Masterclass,The Missing Computer Science and Coding Interview Bootcamp,Colt Steele,4.8,22 total hours,249 lectures,All Levels
https://www.udemy.com/course/data-structures-and-algorithms-deep-dive-using-java/,Data Structures and Algorithms:  Deep Dive Using Java,"Learn about Arrays,  Linked Lists, Trees,  Hashtables, Stacks,  Queues,  Heaps, Sort algorithms and Search algorithms","Tim Buchalka, Goran Lochert, Tim Buchalka's Learn Programming Academy",4.5,16 total hours,116 lectures,Intermediate
https://www.udemy.com/course/python-for-data-structures-algorithms-and-interviews/,"Python for Data Structures, Algorithms, and Interviews!",Get a kick start on your career and ace your coding interviews!,Jose Portilla,4.5,17 total hours,228 lectures,Intermediate
https://www.udemy.com/course/data-structures-and-algorithms-bootcamp-in-python/,The Complete Data Structures and Algorithms Course in Python,Data Structures and Algorithms from Zero to Hero and Crack Top Companies 100+ Interview questions (Python Coding),Elshad Karimov,4.5,41.5 total hours,470 lectures,All Levels
https://www.udemy.com/course/data-structures-algorithms-python/,Data Structures & Algorithms - Python,The Ultimate Python Coding Interview Bootcamp,Scott Barrett,4.9,7 total hours,101 lectures,All Levels
https://www.udemy.com/course/java-data-structures-and-algorithms-masterclass/,Java Data Structures and Algorithms Masterclass,Data Structures and Algorithms from Zero to Hero and Crack Top Companies 100+ Interview questions (Java Coding),Elshad Karimov,4.5,45.5 total hours,424 lectures,All Levels
https://www.udemy.com/course/data-structures-algorithms-javascript/,Data Structures & Algorithms - JavaScript,The Ultimate JavaScript Coding Interview Bootcamp,Scott Barrett,4.8,7 total hours,101 lectures,All Levels
https://www.udemy.com/course/algorithms-and-data-structures-in-python/,Algorithms and Data Structures in Python (INTERVIEW Q&A),"A guide to implement data structures, graph algorithms and sorting algorithms from scratch with interview questions!",Holczer Balazs,4.4,18.5 total hours,189 lectures,All Levels
https://www.udemy.com/course/introduction-to-data-structures/,Easy to Advanced Data Structures,A complete guide to learning everything there is to know about data structures,William Fiset,4.5,8.5 total hours,48 lectures,All Levels
https://www.udemy.com/course/practical-data-structures-algorithms-in-java/,Practical Data Structures & Algorithms in Java + HW,Go from zero to hero in the most important algorithms and data structures using Java,Imtiaz Ahmad,4.7,11.5 total hours,46 lectures,All Levels
https://www.udemy.com/course/dscpp-skills/,Mastering critical SKILLS in Data Structures using C++,Understand DS inner details & design decisions effects + Solve ~180 problems to enhance your problem-solving skills,Dr. Mostafa Saad Ibrahim,4.8,19.5 total hours,200 lectures,All Levels
https://www.udemy.com/course/data-structures-and-algorithms-the-complete-guide/,Data Structures A-Z : Data Structures + Algorithms Bootcamp,Become ace in data structures & algorithms & Crack the code interview by getting mastery in data structures & algorithms,Vinoth Parthasarathy,4.8,7.5 total hours,91 lectures,All Levels
https://www.udemy.com/course/data-structures-and-algorithms-bootcamp/,Data Structures and Algorithms Bootcamp,How to ace your Silicon Valley style coding interview,Jonathan Rasmusson,4.6,6.5 total hours,139 lectures,Beginner
https://www.udemy.com/course/introduction-to-data-structures-algorithms-in-java/,Introduction to Data Structures & Algorithms in Java,Designed to help understand the fundamentals of DS & Algorithms really well. A must have for programming interviews.,Raghavendra Dixit,4.3,5 total hours,103 lectures,All Levels
https://www.udemy.com/course/data-structure-and-algorithms-analysis/,Data Structure and  Algorithms Analysis - Job Interview,"Write code run faster, use less memory and prepare for Software Engineer Interview with real interview questions",Dr. Hussein Alrubaye,4.4,15.5 total hours,101 lectures,All Levels
https://www.udemy.com/course/learning-data-structures-algorithms-in-python-from-scratch/,Data Structures and Algorithms: In-Depth using Python,Implement Data Structures and Algorithms in Python,Syed Mohiuddin,4.3,34.5 total hours,260 lectures,All Levels
https://www.udemy.com/course/algorithms-data-structures-csharp/,Algorithms and Data Structures in C#: Complete Tutorial,Learn data structures and algorithms in C# from A to Z. Pass coding interview. Learn unit testing and TDD in addition.,Engineer Spock,4.3,15.5 total hours,137 lectures,All Levels
https://www.udemy.com/course/algorithms-and-data-structures-in-java-part-ii/,Algorithms and Data Structures in Java - Part II,"Tries Data Structures, Ternary Search Trees, Data Compression, Substring Search and Sorting Algorithms",Holczer Balazs,4.6,11 total hours,92 lectures,All Levels
https://www.udemy.com/course/data-structures-and-algorithms-for-coding-interview/,Data Structures and Algorithms for Coding Interview,Build your strong understanding in data structures and algorithms for coding interview. Get more job offer.,Md. A. Barik,4.3,14.5 total hours,142 lectures,All Levels
https://www.udemy.com/course/data-structures-and-algorithms-in-csharp/,Data Structures and Algorithms In C#,Data Structures and Algorithms in C# Using Data Structures Algorithms with C# Data Structures Algorithms C# DSA Leetcode,Deepali Srivastava,4.4,10.5 total hours,148 lectures,All Levels
https://www.udemy.com/course/from-0-to-1-data-structures/,From 0 to 1: Data Structures & Algorithms in Java,Learn so you can see it with your eyes closed,Loony Corn,4.4,15 total hours,67 lectures,All Levels
https://www.udemy.com/course/advanced-algorithms-python/,Advanced Algorithms and Data Structures in Python,"Fenwick trees, Caches, Splay Trees, Prefix Trees (Tries), Substring-Search Algorithms and Travelling Salesman Problem",Holczer Balazs,4.6,8.5 total hours,68 lectures,All Levels
https://www.udemy.com/course/data-structures-stack-queue-linkedlist/,Fundamental Data Structures & Algorithms using C language.,"Learn Data Structures and algorithms for Stack, Queue, Linked List, Binary Search Tree and Heap ( using C Programming ).",Shibaji Paul,4.4,15.5 total hours,125 lectures,All Levels
https://www.udemy.com/course/data-structures-and-algorithms-in-c/,Data Structures and Algorithms In C,Data Structures and Algorithms in C Using Data Structures Algorithms with C Data Structures Algorithms C leetcode DSA C,Deepali Srivastava,4.0,10.5 total hours,150 lectures,All Levels
https://www.udemy.com/course/python-programming-algorithms-data-structures/,"Python 3: Project-based Python, Algorithms, Data Structures",Learn programming with Python 3; visualize Algorithms and Data Structures and implement them in projects with Python,"Mashrur Hossain, Nathan House",4.7,14.5 total hours,102 lectures,All Levels
https://www.udemy.com/course/data-structures-and-algorithms-in-java/,Data Structures and Algorithms In Java for Coding Interview,Data Structures and Algorithms in Java to crack Coding Interview Using Java Data Structures Algorithms Java DSA Leetcode,Deepali Srivastava,4.2,10.5 total hours,148 lectures,All Levels
https://www.udemy.com/course/data-structures-and-algorithms-masterclass/,Data Structures and Algorithms Python: The Complete Bootcamp,"DSA Basics To Advanced: Learn, Analyze, Implement Data Structures and Algorithms using Python With Interview Questions",Shubham Sarda,4.5,20 total hours,121 lectures,All Levels
https://www.udemy.com/course/cpp-deep-dive/,Learn C++ Programming -Beginner to Advance- Deep Dive in C++,"Classroom and Hands-on sessions- Features of C++ 11 , Exception Handling and STL -  for Both Academics and Industry",Abdul Bari,4.6,30.5 total hours,279 lectures,All Levels
https://www.udemy.com/course/data-structures-algorithms-in-python/,Data Structures and Algorithms In Python,Data Structures and Algorithms in Python using Data Structures Algorithms with Python Data Structures DSA Algo Leetcode,Deepali Srivastava,3.9,10.5 total hours,132 lectures,All Levels
https://www.udemy.com/course/data-structures-and-algorithms-in-csharp-2/,Advanced Data Structures and Algorithms in C# (Graphs/Trees),Advanced Data Structures and Algorithms in C# Using Graphs Trees Data Structures Algorithms C# Advanced DSA C# Leetcode,Deepali Srivastava,4.8,7 total hours,66 lectures,All Levels
https://www.udemy.com/course/discrete-structures-and-applications/,"Discrete Structures, Data Structures, and Algorithms",Foundations of Computing,Matthew Fried,4.4,29 total hours,112 lectures,All Levels
https://www.udemy.com/course/learning-data-structures-and-algorithms/,Learning Data Structures and Algorithms,Implementation and Analysis for Increased Software Performance,Infinite Skills,4.7,8 total hours,102 lectures,Beginner
https://www.udemy.com/course/algorithms-and-data-structures/,Data Structures in Java - Part I (+INTERVIEW QUESTIONS),"Basic Algorithms and Data Structures: AVL tree, Binary Search Trees, Arrays, B trees, Linked Lists, Stacks and HashMaps",Holczer Balazs,4.5,15 total hours,156 lectures,All Levels
https://www.udemy.com/course/data-structures-and-algorithms-in-c-for-beginners/,Data Structures and Algorithms in C for Beginners,"Learn, understand and implement DSA in C Programming",Sujithkumar MA,4.1,10 total hours,65 lectures,All Levels
https://www.udemy.com/course/data-structures-and-algorithms-using-java/,Data Structures and Algorithms in java,"Data Structures and algorithms: Binary Search Tree (BST), Linked List, Stack, Queue, Array, Selection and Insertion Sort",Muhammad Hamza AbdulRehman,4.6,3 total hours,44 lectures,All Levels
https://www.udemy.com/course/introduction-to-data-structures-algorithms/,Introduction to Data Structures & Algorithms,Learn Data Structure & Algorithm from Scratch.,Swastik Arora,4.7,16.5 total hours,88 lectures,Beginner
https://www.udemy.com/course/data-structures-and-algorithms-in-java-2/,Advanced Data Structures and Algorithms in Java (Graph/Tree),Advanced Data Structures and Algorithms in Java Using Graphs Trees Data Structures Algorithms Java Advanced DSA Leetcode,Deepali Srivastava,4.4,7.5 total hours,66 lectures,All Levels
https://www.udemy.com/course/data-structures-and-algorithms-for-all-developers/,Data Structures and Algorithms for Beginners,This course explains how data structures and algorithms work with ANIMATIONS. Animation is the best way to understand it,Elshad Karimov,3.9,2.5 total hours,32 lectures,All Levels
https://www.udemy.com/course/algorithms-data-structures-in-java-engineering-interview/,Data Structures and Algorithms in Java,"Learn data structures and algorithms in Java, Improve your Problem solving abilities and logical thinking.",Luke's Programming School,4.1,2.5 total hours,39 lectures,All Levels
https://www.udemy.com/course/data-structures-and-algorithms-in-the-c-programming-language/,Data Structures And Algorithms In The C Programming Language,"Linked Lists, Array Lists, Stacks, Queues, Trees the lot!",Daniel McCarthy,4.8,2.5 total hours,15 lectures,Intermediate
https://www.udemy.com/course/data-structures-and-algorithms-z/,Data Structures and Algorithms,Data Structures operations and Analysing Algorithms,VENKATACHALAM MAHESWARI,3.8,5.5 total hours,27 lectures,Beginner
https://www.udemy.com/course/data-structures-and-algorithms-in-swift/,Data Structures and Algorithms in Swift,Implementing Practical Data Structures with Swift,Mohammad Azam,4.6,4 total hours,55 lectures,Intermediate
https://www.udemy.com/course/clang-algo-ds/,C Language + Algorithms + Data Structures = Power,Up and running with c Programming language and algorithms and data structures,Nidhal Abidi,4.3,17 total hours,94 lectures,All Levels
https://www.udemy.com/course/introduction-to-algorithms-in-swift/,Introduction to Algorithms and Data Structures in Swift 5,Lay the foundations of algorithms and data structures in Swift 5. Level up your Swift 5 coding skills.,Karoly Nyisztor • Professional Software Architect,4.1,2 total hours,60 lectures,All Levels
https://www.udemy.com/course/kal-academy-algorithms-and-data-structures-part-1/,Algorithms and Data structures - Part 1,Ace your next technical interview!,Kal Academy,4.9,1.5 total hours,11 lectures,Beginner
https://www.udemy.com/course/python-for-patterns-problems-data-structures-algorithms/,"Python for Patterns, Problems, Data Structures & Algorithms","Python for Pattern programs, Example Programs (Interview problems), Data Structures and Algorithms (3 in 1) course",Vinayak Bhosale,5.0,7.5 total hours,64 lectures,All Levels
https://www.udemy.com/course/coding-interview-essentials/,Coding Interview Essentials: Data Structures & Algorithms,The essential guide to getting a programming job. Learn how to get more interviews and land the offer!,Ibrahim Irfan,4.7,5.5 total hours,92 lectures,All Levels
https://www.udemy.com/course/data-structures-and-algorithms-in-java-for-coding-interview/,Data Structures and Algorithms in Java For Coding Interview,Algorithmic Problems in Java that range a variety of data structures which often pop up during a coding interview.,El Farouk Yasser,4.4,6 total hours,55 lectures,Intermediate
https://www.udemy.com/course/data-structures-and-algorithms-using-java-and-intellij/,Data Structures and Algorithms using Java and Intellij,"Practical training to ace your coding interviews. Learn LinkedList, Maps, Graphs, Binary Trees, Binary Search Trees, etc",Faisal Memon,4.6,8.5 total hours,92 lectures,All Levels
https://www.udemy.com/course/algorithms-and-data-structures-in-javascript/,Algorithms and Data Structures in Javascript (2020),Master algorithms and data structures in Javascript.,Luke's Programming School,4.7,5 total hours,44 lectures,All Levels
https://www.udemy.com/course/algorithms-and-data-structures-part-2/,Algorithms and Data Structures - Part 2,Ace your next technical interview!,Kal Academy,5.0,1.5 total hours,8 lectures,Beginner
https://www.udemy.com/course/cracking-faang-coding-interviews-masterclass-learn-data-structures/,Cracking Coding Interviews Masterclass: C++ Data Structures,Crash Course to Crack your Coding Interview in C++ by Mastering Data Structures in STL,Arnav Rupde,4.3,1 total hour,8 lectures,Intermediate
https://www.udemy.com/course/advanced-data-structures-and-algorithms-linked-lists/,Advanced Data Structures & Algorithms in Java: Linked-List,"Create, Implement and solve problems using the link list data structure with Java programming language",Esther Peters,4.3,3.5 total hours,26 lectures,All Levels
https://www.udemy.com/course/data-structures-and-algorithms-in-python-2/,Advanced Data Structures & Algorithms in Python (Graph/Tree),Advanced Data Structures and Algorithms in Python Using Graphs Trees Data Structures Algorithms Python Advanced DSA Algo,Deepali Srivastava,4.5,7 total hours,65 lectures,All Levels
https://www.udemy.com/course/data-structures-and-algorithms-in-depth-using-c-sharp/,Data Structures and Algorithms: In Depth using C#,"List, Stacks, Queues, Binary Search Trees, Hashing, Heaps, Graphs, Sorting, Searching - Data Structures & Algorithms C#",Syed Mohiuddin,4.1,28.5 total hours,228 lectures,Beginner
https://www.udemy.com/course/linked-list-data-structures-and-algorithms-for-interviews/,Linked List Data Structures and Algorithms for Interviews,Master Linked Lists algorithms for Programming Interviews,Abhishek Kumar,4.7,5.5 total hours,24 lectures,All Levels
https://www.udemy.com/course/the-data-structures-algorithms-and-time-complexity-guide/,"The Data Structures, Algorithms and Time Complexity Guide",The Definitive Coding Interview Guide: Crack Whiteboard Questions in C# & Recognize Patterns in the Most Popular Topics,"Mammoth Interactive, John Bura",4.9,7 total hours,55 lectures,All Levels
https://www.udemy.com/course/fundamental-data-structures-bootcamp-interviews/,Master Important Data Structures and Algorithms in Java.,"Learn and Master Linked List, Stack, Queue, Hashtable, Heap, Graph, Graph Algorithms, Search Algorithm & Sort Algorithms",Manoranjan Kumar,4.5,15 total hours,126 lectures,All Levels
https://www.udemy.com/course/coding-java-interview-algorithms-data-structure/,Data Structures and Algorithms MasterClass: Coding Interview,Ace your next Java coding interview by mastering in data Structures and algorithms. Deep dive using Java,LevelUp360° DevOps | Google Cloud | Terraform | Kubernetes,4.2,13 total hours,65 lectures,All Levels
https://www.udemy.com/course/tree-data-structure-and-algorithms/,Tree Data Structure and Algorithms,Mastering the art of solving Tree problems and acing the Coding Interviews,Sweet Codey,4.0,2.5 total hours,16 lectures,All Levels
https://www.udemy.com/course/data-structure-with-c-plus-plus/,Data Structure with C++ : Zero to Hero,"Learn about Pointers , Arrays, Linked Lists, Stacks and Queues, Graph, Binary Trees, Heap & Priority Queue, Sorting etc.",Up Degree,4.4,8 total hours,55 lectures,Intermediate
https://www.udemy.com/course/advanced-algorithms-in-java/,Advanced Algorithms (Graph Algorithms) in Java,"Breadth-First Search, Depth-First Search, Shortest Path, Arbitrage, Strongly Connected Components and Maximum Flow",Holczer Balazs,4.6,11 total hours,88 lectures,All Levels
https://www.udemy.com/course/the-swift-arcade-data-structures-and-algorithms-bootcamp/,The Swift Arcade Data Structures and Algorithms Bootcamp,How to ace your Silicon Valley style coding interview,Jonathan Rasmusson,4.7,7 total hours,118 lectures,Beginner
https://www.udemy.com/course/python-solved-interview-ques-on-algorithms-data-structures/,"Python: Solved Interview Ques on Algorithms, Data Structures","Understanding The Solutions For Various Interview Questions On Algorithms, Data structures In Python",Satish Venkatesh,3.8,9.5 total hours,116 lectures,All Levels
https://www.udemy.com/course/data-structure-algorithms-for-beginners-for-data-science/,Learn Data structures & Algorithms using Python for Freshers,Learn to master Data structure Algorithm by understanding concepts through time complexity and implementation in Python3,Chandramouli Jayendran,2.9,19.5 total hours,199 lectures,Beginner
