url,Course Title,Course Headline,Instructor,Rating,course_length,number_of_lectures,difficulty
https://www.udemy.com/course/data-structures-and-algorithms-in-depth-using-java/,Data Structures and Algorithms: In Depth using Java,"List, Stacks, Queues, Binary Search Trees, Hashing, Heaps, Graphs, Search, Sorting- Data Structures & Algorithms in Java",Syed Mohiuddin,4.1,28.5 total hours,229 lectures,Beginner
https://www.udemy.com/course/data-structures-and-algorithms-in-c-2/,Advanced Data Structures and Algorithms in C (Graphs/Trees),Advanced Data Structures and Algorithms in C Using Graphs Trees Data Structures Algorithms C Advanced DSA C Leetcode,Deepali Srivastava,4.8,7 total hours,66 lectures,All Levels
https://www.udemy.com/course/algorithms-data-structures/,Algorithms and Data Structures,Develop your programming logic by creating Algorithms and learn how to implement different Data Structures.,Jose Javier Villena,5.0,6 total hours,52 lectures,Intermediate
https://www.udemy.com/course/data-structures-and-algorithm-in-php-part-one/,Data Structures And Algorithms In PHP,"Linked list, Stacks, Queues And Interview Problems",Joshua Melvin Benhar,4.0,4.5 total hours,76 lectures,Beginner
https://www.udemy.com/course/data-structures-and-algorithms-from-0-to-hero/,Data Structures and Algorithms : From 0 to HERO,The best way to train your programming skills,Carmen Mitru,4.0,2 total hours,21 lectures,All Levels
https://www.udemy.com/course/algorithm/,Data Structures and Algorithms - High Level MADE EASY,"Abstract reasoning makes algorithms easy.   Learn about Sort, Search, Trees, Hash Tables, and Heaps.",Gopal Shangari,3.1,8.5 total hours,37 lectures,All Levels
https://www.udemy.com/course/data-structures-and-algorithms-in-python-using-python/,Data Structures and Algorithms in python,"Coding and concepts building of many data structures and algorithms like Linked List, Trees, Stack, Sorts and much more",Muhammad Hamza AbdulRehman,4.0,2.5 total hours,42 lectures,All Levels
https://www.udemy.com/course/learning-javascript-data-structures-and-algorithms/,Learning JavaScript Data Structures and Algorithms ,Find out how data structures and algorithms can be used to solve programming problems using JavaScript,Packt Publishing,3.4,1.5 total hours,15 lectures,Beginner
https://www.udemy.com/course/the-essential-algorithms-and-data-structures/,The Essential Algorithms and Data Structures,Learn how to master the most important algorithms and data structures to become a professional-grade engineer,Anirudh Balasubramanian,3.8,13 total hours,96 lectures,Intermediate
https://www.udemy.com/course/data-structures-and-algorithms-course-1/,Data Structures and Algorithms - Course 1,Master the fundamentals of data structures and algorithms.,Abhishek Kumar,2.4,3.5 total hours,21 lectures,All Levels
https://www.udemy.com/course/data-structures-algorithms-coding-interview/,Data Structures and Algorithms | Coding Interview Q&A,Learn Data Structures & Algorithms from Scratch. + Master Coding Interviews . From basic to advanced.,Darío Leegstra,3.0,12.5 total hours,126 lectures,Beginner
https://www.udemy.com/course/beginning-data-structures-and-algorithms-in-c/,Beginning Data Structures and Algorithms in C#,Explore the possibilities of C# for developing a variety of applications,Packt Publishing,3.9,3 total hours,23 lectures,Intermediate
https://www.udemy.com/course/javascript-data-structure-and-algorithm-crash-course/,JavaScript Data Structure and Algorithm Crash Course,Understanding JavaScript Data Structure and Sorting Algorithms,OnlyKiosk Tech,5.0,2 total hours,33 lectures,Intermediate
https://www.udemy.com/course/data-structures-and-algorithms-x/,Data Structures and Algorithms (C# code in GitHub),"Search, Sort, Binary Heaps, Binary Trees, Nary Trees (paired with C# implementations in an open source GitHub repo)",Parisa Jalili Marandi,3.9,6.5 total hours,46 lectures,All Levels
https://www.udemy.com/course/coding-interview-master-data-structures-and-algorithms/,Data Structures & Algorithms Cracking Coding Interviews 2021,Quickly prepare for cracking the coding rounds! This course covers coder interview questions and coding interview prep!,Shan A. (Google Tech Lead),3.8,2 total hours,12 lectures,All Levels
https://www.udemy.com/course/data-structure-and-algorithm-with-python/,Data Structure and Algorithm With Python,A Comprehensive guide to learn Data Structures and Algorithms in python.,Code Smart Academy,3.1,6 total hours,73 lectures,All Levels
https://www.udemy.com/course/algorithms-and-data-structures-made-easy-for-interview/,Algorithms and Data Structures Easy Way Java - job interview,Become the star that you can be!,Marcos Costa,3.8,8 total hours,49 lectures,All Levels
https://www.udemy.com/course/datastructures/,Data Structures in C++,Learn and master the popular data structures in C++,Nisha Kiran,2.2,42 total mins,28 lectures,All Levels
https://www.udemy.com/course/advanced-data-structures-and-algorithms-in-python/,Advanced Data Structures and Algorithms in Python,Develop new algorithms and solutions to problems by combining advanced algorithms creatively in Python,Packt Publishing,3.6,4 total hours,33 lectures,Expert
https://www.udemy.com/course/learn-algorithms-and-data-structures-in-java/,Learn Algorithms and Data Structures in Java,Leverage Java Algorithms for Operational Efficiency,Packt Publishing,3.6,2.5 total hours,22 lectures,Intermediate
https://www.udemy.com/course/coding-interview-algorithms-datastructures/,[हिंदी]Coding Interview - Algorithm & Data Structures Python,Student's will learn how to solve various types of coding interview questions and how to arrive at a solution.,Vinay Kumar,4.8,8 total hours,48 lectures,All Levels
https://www.udemy.com/course/functional-data-structures-and-algorithms/,Functional Data Structures and Algorithms,Learn functional data structures and algorithms for your applications and bring their benefits to your work now,Packt Publishing,3.1,2 total hours,27 lectures,Intermediate
https://www.udemy.com/course/data-structure-algorithm-design-pattern-in-c-net-core/,"Data Structure, Algorithm & Design Pattern in C# & .NET Core",Implement basic data structures and algorithms in C# to code faster by implementing high-quality design patterns,Packt Publishing,4.4,7.5 total hours,49 lectures,Beginner
https://www.udemy.com/course/c-data-structures-and-algorithms/,C# Data Structures and Algorithms,Implement algorithms and data structures for real-world problems in C# and .NET Core and become a better programmer,Packt Publishing,3.5,4.5 total hours,20 lectures,Intermediate
https://www.udemy.com/course/data-structure-and-algorithms-in-java-8-and-above/,Data Structure and Algorithms in Java 8 and above,Learn Data Structure and Algorithms and their Implementation in java 8 and Lambda functions.,Arun Singh,3.0,6.5 total hours,41 lectures,All Levels
https://www.udemy.com/course/graph-theory-algorithms/,Graph Theory Algorithms,A complete overview of graph theory algorithms in computer science and mathematics.,William Fiset,4.7,9 total hours,46 lectures,All Levels
https://www.udemy.com/course/data-structures-interview-guide/,Data Structures and Algorithms -Interview Guide,Test Series in Data Structures and algorithms,Suprio Dutta,5.0,250 questions,All Levels,All Levels
https://www.udemy.com/course/leetcode-coding-interview-question-solution-explanation/,LeetCode in Java: Algorithms Coding Interview Questions,Ace your next coding interview by solving essential coding interview questions and get an offer from big tech company.,Md. A. Barik,4.2,27.5 total hours,139 lectures,All Levels
https://www.udemy.com/course/hands-on-data-structure-algorithm-with-python-2-in-1/,Hands On Data Structure & Algorithm with Python: 2 in 1,Enhance you object-oriented skills with data structure & algorithms,Packt Publishing,3.4,5 total hours,56 lectures,Expert
https://www.udemy.com/course/video-course-c-from-beginner-to-expert/,C++: From Beginner to Expert,Designed for people who don't have any knowledge about the programming and want to program in C++,Arkadiusz Włodarczyk,4.5,17.5 total hours,95 lectures,All Levels
https://www.udemy.com/course/data-structures-and-algorithms-in-swift-and-ios/,Data Structures and Algorithms in Swift and iOS,Cracking programming interviews and Ace them by learning algorithms and data structures with real interview questions,DevTechie Inc,4.0,10.5 total hours,51 lectures,All Levels
https://www.udemy.com/course/ultimate-coding-interview-prep-algorithms-data-structures/,Ultimate Coding Interview Prep: Algorithms & Data Structures,"Learn the best way to answer an interview question, solve the most commonly asked questions and analyze time complexity!","Mammoth Interactive, John Bura",4.1,7 total hours,59 lectures,Beginner
https://www.udemy.com/course/leetcode-in-python-50-algorithms-coding-interview-questions/,LeetCode In Python: 50 Algorithms Coding Interview Questions,"Practice data structure and algorithms questions for interviews at FAANG companies like Google, Facebook, Apple & Amazon",Bit Punch,4.5,19.5 total hours,184 lectures,Intermediate
https://www.udemy.com/course/learning-data-structures-in-javascript-from-scratch/,Learning Data Structures in JavaScript from Scratch,Write more efficient & performant code by learning data structures.  Be well prepared for technical interview questions.,Eric Traub,4.4,3.5 total hours,56 lectures,All Levels
https://www.udemy.com/course/graph-theory-algorithms-for-competitive-programming/,Graph Theory Algorithms for Competitive Programming (2021),"Learn Graphs Algorithms in Computer Science & Mathematics, theory + hands-on coding and ace Competitive Coding problems!","Prateek Narang, Apaar Kamal, Coding Minutes",4.6,20 total hours,99 lectures,All Levels
https://www.udemy.com/course/learning-pathlearning-functional-data-structure-algorithm/,Learning Path:Learning Functional Data Structure & Algorithm,Unlock complex data structures and algorithms and get the most out of functional programming,Packt Publishing,3.6,5.5 total hours,59 lectures,Beginner
https://www.udemy.com/course/learning-pathjava-data-structures-algorithms-with-java-9/,Learning Path:Java: Data Structures & Algorithms with Java 9,Unleash the power of Java 9 to master data structures and algorithms from scratch,Packt Publishing,3.1,6 total hours,38 lectures,Intermediate
https://www.udemy.com/course/python-data-structures-algorithms-and-time-complexity-guide/,"Python Data Structures, Algorithms and Time Complexity Guide",The Definitive Coding Interview Guide: Crack Whiteboard Questions & Recognize Patterns in the Most Popular Topics,"Mammoth Interactive, John Bura",3.1,5.5 total hours,52 lectures,All Levels
https://www.udemy.com/course/advanced-data-structures-and-algorithms-in-java-9/,Advanced Data Structures and Algorithms in Java 9,Explore the world of advanced algorithms with Java 9,Packt Publishing,3.1,3 total hours,19 lectures,Intermediate
https://www.udemy.com/course/data-structures-and-algorithms-all/,Data Structures and Algorithms,A guide for learning Data Structures operations & Analyze the Algorithms by implementing the practical Data Structures.,Rashmi V,,3.5 total hours,36 lectures,Intermediate
https://www.udemy.com/course/six-phrase-myslate-mastering-data-structure-using-c/,Mastering Data Structure Using C,Let us Master it,SACHIN NANDHA SABARISH J,4.1,36.5 total hours,108 lectures,Expert
https://www.udemy.com/course/learn-linked-lists-stacks-and-queues-in-python/,Master Data Structures for Optimal Solutions in Python,Data Structures Made Easy - Master the Optimal Solution to Programming Challenges with Proven Data Structures,Rune Thomsen,4.6,4.5 total hours,38 lectures,All Levels
https://www.udemy.com/course/master-the-coding-interview-big-tech-faang-interviews/,Master the Coding Interview: Big Tech (FAANG) Interviews,"Ace the Google, Amazon, Facebook, Microsoft, Netflix coding interviews. Step by step guide for their toughest questions!","Andrei Neagoie, Yihua Zhang",4.7,36.5 total hours,287 lectures,Intermediate
https://www.udemy.com/course/advanced-algorithms-using-java/,Advanced Algorithms in Java,Understand Algorithms and Data structure at a deep level. Grow your career and be ready to answer interview questions!,"Tim Buchalka's Learn Programming Academy, Marcos Costa",4.5,16 total hours,72 lectures,All Levels
https://www.udemy.com/course/the-complete-cpp-developer-course/,The Complete C++ Developer Course,Master theory and practice using one of the world's most popular programming languages!,"Codestars by Rob Percival, John P. Baugh",4.6,22.5 total hours,122 lectures,All Levels
https://www.udemy.com/course/data-structures-from-scratch/,Data Structures From Scratch,This course is designed to help you understand concepts of data structures in detail with applications,SaifAli Kheraj,4.1,8.5 total hours,53 lectures,All Levels
https://www.udemy.com/course/data-structures-in-python/,Data Structures in Python,"Practical Implementation of Python data structures to perform complex Data Analysis, Store and Retrieve Data Efficiently",Kumar Rajmani Bapat,4.0,3 total hours,22 lectures,All Levels
https://www.udemy.com/course/beginning-java-data-structures-and-algorithms/,Beginning Java Data Structures and Algorithms,Sharpen your problem solving and data organization skills using Java data structures and algorithms,Packt Publishing,4.5,3 total hours,35 lectures,Beginner
https://www.udemy.com/course/best-algorithms-and-data-structures-interview-questions/,Best Algorithms and Data Structures Interview Questions !,One Stop for you !. Get the best Coding questions which have been asked by the Big Tech companies.,Aman Gupta,,28 questions,All Levels,Beginner
https://www.udemy.com/course/data-structures-with-python/,Data Structures with Python,The All-In-one Course for you to Conquer Data Structures with Python,Neeraj Ap,3.9,9 total hours,227 lectures,Beginner
https://www.udemy.com/course/learn-data-structures-using-c-programming-language/,Learn Data Structures using C Programming Language,"Hands-on course with exercises on arrays, stacks, queues, linked list, trees, graphs, internal sorting techniques, etc.",Gayatri TR,4.4,9 total hours,90 lectures,All Levels
https://www.udemy.com/course/learn-graph-algorithms-with-cpp/,Learn Graph algorithms with C++,Lets implement graph theory related algorithms with C++,Kasun Liyanage,3.3,2.5 total hours,31 lectures,All Levels
https://www.udemy.com/course/data-structure-for-fledgling-learners/,data structure for fledgling learners,Data Structure and algorithms,Chetan dhotre,4.7,1 total hour,8 lectures,Intermediate
https://www.udemy.com/course/150-exercises-data-structures-in-python/,150+ Exercises - Data Structures in Python - Hands-On,Improve your Python programming skills and solve over 150 exercises with data structures!,Paweł Krakowiak,4.4,1 total hour,181 lectures,Intermediate
https://www.udemy.com/course/sorting-algorithms/,Sorting Algorithms using Java & C: Make Your Basics Strong,Learn Analysis of Algorithm using asymptotic notations like Big Oh and others. Understand and analyse sorting algorithms,Shibaji Paul,4.6,6.5 total hours,60 lectures,Intermediate
https://www.udemy.com/course/c-from-beginners-to-advanced/,C++ from Beginners to  Object Oriented  Data Structures,"Jump start your C++ Programming Skills through Practical Projects with Basics to Linked Lists , Trees , Pointers, Header","Muhammad Luqman, Zaheer Ahmed",,4.5 total hours,26 lectures,Beginner
https://www.udemy.com/course/advanced-data-structures-algorithms-interview-1200-qa/,2021 Data Structures & Algorithms (INTERVIEW 1200+ Q&A),"Master solving Data Structures & Algorithms problems & topic wise questions, This test help you preparing tech interview",Rakibul Hasan Khan,,1.5 total hours,17 lectures,All Levels
https://www.udemy.com/course/ace-tech-companies-coding-interview-in-a-month/,"Coding Interview Bootcamp: Algorithms (Java, Python, C++)",Get ready in a Month + Help from Google/Facebook Interviewer with 1000+ coding questions experience,CodeMan Liu,4.6,13 total hours,174 lectures,All Levels
https://www.udemy.com/course/become-a-coding-warrior-data-structure/,Become a Coding Warrior: Data Structure and Algorithm,Learn Data Structure & algorithms from scratch to crack any coding interview and get your dream job in tech giants!!,Rajat Saini,,6.5 total hours,104 lectures,All Levels
https://www.udemy.com/course/algorithms-data-structures-coding-interviews-with-python/,Algorithms + Data Structures + Coding Interviews with Python,Learn algorithms and data structures using Python. Practice solving popular coding questions to ace your next interview!,"Yuko Sakai, Jun Sakai",,12.5 total hours,63 lectures,Beginner
https://www.udemy.com/course/data-structures-using-javascript/,Data Structures using Javascript,This course will focus on the aspects of working with data structures and algorithms using Javascript,SimpliCode Point,3.9,8 total hours,66 lectures,All Levels
https://www.udemy.com/course/kal-academy-algorithms-and-data-structures-part-3/,Algorithms and Data Structures - Part 3,Ace your next technical interview!,Kal Academy,,1.5 total hours,10 lectures,Intermediate
https://www.udemy.com/course/learn-advanced-c-programming/,Learn Advanced C++ Programming,"Discover intermediate to advanced C++, including C++ 11's fantastic additions to the C++ standard.",John Purcell,4.5,15 total hours,105 lectures,Intermediate
https://www.udemy.com/course/data-structuresalgorithms-asymptotic-notation-recurrences/,"Data Structures&Algorithms-Asymptotic Notation, Recurrences","Learning Asymptotic Behaviour, Solving Recurrences",VENKATACHALAM MAHESWARI,4.4,3 total hours,20 lectures,Intermediate
https://www.udemy.com/course/smtdatastruct/,Live Coding with Data Structures for campus/internship/jobs,Hands on Implementation / Coding with Data Structures,Shrirang Korde,4.7,25 total hours,86 lectures,Intermediate
https://www.udemy.com/course/learn-data-structure-using-c-programming-language/,Learn Data Structure Using 'C Programming Language,Getting Started With Data Structure Using 'C Programming Language From Core Basics,Ayesha Khan,3.0,34 total mins,17 lectures,Beginner
https://www.udemy.com/course/the-modern-cpp-20-masterclass/,The C++ 20 Masterclass :  From Fundamentals to Advanced,Learn and Master Modern C++ From Beginning to Advanced in Plain English :  C++11 all the way to C++20 and More!,Daniel Gakwaya,4.7,112 total hours,563 lectures,Beginner
https://www.udemy.com/course/modern-cpp-concurrency-in-depth/,Modern C++ Concurrency in Depth ( C++17/20),"modern c++ concurrency features including memory model, lock free data structure, thread pools, coroutines.",Kasun Liyanage,4.4,10 total hours,98 lectures,Intermediate
https://www.udemy.com/course/data-structures-in-javascript/,Data Structures in JavaScript,Learn to implement popular Data Structures in JavaScript. Learn real world programming and get Job ready,"Eduonix Learning Solutions, Eduonix-Tech ., Samy Eduonix",3.3,11 total hours,51 lectures,Intermediate
https://www.udemy.com/course/deep-dive-into-algorithms/,Deep Dive into Algorithms,Deep Dive into Algorithms,SACHIN NANDHA SABARISH J,4.1,32.5 total hours,82 lectures,Expert
https://www.udemy.com/course/algorithms-and-programming-techniques/,Algorithms and Programming Techniques,A guided tour for the most common Algorithms and Programming Techniques,Lucian Ilea,5.0,2.5 total hours,14 lectures,Intermediate
https://www.udemy.com/course/algorithms-c-concepts-examples-code/,"Algorithms in C : Concepts, Examples, Code + Time Complexity","Learn algorithms in C language. Understand Logic with examples, practice code and crack those programming interviews!","Engineering Mentor, Pratibha B.",4.0,3.5 total hours,34 lectures,All Levels
https://www.udemy.com/course/algorithm-design-techniques-live-coding-in-javascript/,Algorithms in JavaScript  : Design techniques,"Data Structures, Complexity Analysis,Recursion, backtracking, Dynamic Programming,Greedy algorithm, Divide and Conquer",Basics Strong,4.5,17.5 total hours,157 lectures,All Levels
https://www.udemy.com/course/learning-algorithms-in-javascript-from-scratch/,Learning Algorithms in JavaScript from Scratch,Make your code & programs faster and more efficient by using algorithms. Be very well prepared for technical interviews.,Eric Traub,4.3,3.5 total hours,69 lectures,All Levels
https://www.udemy.com/course/searching-and-sorting-algorithms/,Searching and Sorting Algorithms,Visualize Searching and Sorting Algorithms and Implement them in C++,Sujithkumar MA,4.2,4.5 total hours,29 lectures,All Levels
https://www.udemy.com/course/logn-data-structure-part2/,Data Structure - Part 2,"Create, Implement and Practice Data Structures with Detailed Implementation Analysis",Log(n) Academy,3.6,8 total hours,36 lectures,Intermediate
https://www.udemy.com/course/python-linked-list/,Linked List Data Structure using Python,Unlock your data structures potential by being able to create your own linked list in Python,Febin George,4.9,4 total hours,56 lectures,Intermediate
https://www.udemy.com/course/comprehensive-algorithms/,Comprehensive Algorithms,This course provides a comprehensive overview of the concepts of algorithm analysis and development.,Jordan Hudgens,4.0,3.5 total hours,29 lectures,All Levels
https://www.udemy.com/course/graph-theory/,Graph Theory,"Master the Nuts and Bolts of Graph Theory: the Heart of Communication and Transportation Networks, Internet, GPS, ...",Miran Fattah,4.7,10 total hours,67 lectures,All Levels
https://www.udemy.com/course/skills-coding-interviews/,Mastering critical SKILLS for Coding Interviews: Part 1,Data Structures Part: Solving the MOST FREQUENT FAANG interview problems,Dr. Mostafa Saad Ibrahim,5.0,16.5 total hours,123 lectures,Intermediate
https://www.udemy.com/course/learn-python-from-basics-to-data-structure/,Learn Python: From Basics to Data Structure,Python: Basics Concepts and Data Structure,Hadi youness,4.3,6.5 total hours,41 lectures,Beginner
https://www.udemy.com/course/understand-the-built-in-functions-and-algorithms/,Learn C++: Algorithms and Functions,"What are Algorithms and Functions, how do they change the way we code, how will they help us in the future? Learn now!",Aleksandar Stankovski,3.1,3 total hours,17 lectures,Beginner
https://www.udemy.com/course/learn-algorithm-programming/,Learn Algorithm Programming,Learn the basic concepts of Algorithms,Joseph M.,4.0,1.5 total hours,21 lectures,All Levels
https://www.udemy.com/course/python-data-structures-a-to-z/,Python Data Structures A to Z,Learn the essentials of data structures in Python.,Joe James,4.3,2 total hours,15 lectures,Intermediate
https://www.udemy.com/course/data-structuresalgorithms-mcqs-with-explonation/,Data Structures&Algorithms-MCQS with Explanation,Data structures explanation 1-10 yrs hands on experience,Rajesh Reddy,4.5,230 questions,All Levels,Intermediate
https://www.udemy.com/course/c-programming-step-by-step-from-beginner-to-ultimate-level/,C++ Programming Step By Step From Beginner To Ultimate Level,"Discover C++ basics then Expert on Object Oriented Programming OOP, C++ Data structure, STL, C++ Projects with C++ 11/14",Lernen Hub Academy,4.2,11.5 total hours,100 lectures,All Levels
https://www.udemy.com/course/algorithmic-problems-in-python/,"Recursion, Backtracking and Dynamic Programming in Python","Learn Recursion, Backtracking, Divide and Conquer Methods and Dynamic programming via Examples and Problems in Python",Holczer Balazs,4.5,9 total hours,91 lectures,All Levels
https://www.udemy.com/course/advanced-data-structures-tree-adt/,Advanced Data Structures-Part I-TREE ADT,"Non Linear Abstract Data Type-Trees-Binary Tree-Binary Search Tree, Heap,AVL Tree,Red-Balck Tree, B-tree.",VENKATACHALAM MAHESWARI,5.0,6.5 total hours,31 lectures,Intermediate
https://www.udemy.com/course/programming-and-data-structures/,Programming and data structures,"Binary Heaps, Graphs, AVL trees, Binary search trees  ,Pointers, function pointers, Structures, Unions,",Pint Raj,5.0,10 questions,Beginner,Intermediate
https://www.udemy.com/course/design-and-analysis-of-algorithm-/,The Design and Analysis of Algorithm Masterclass [ 2021],Algorithm & Data Structures will help you to Crack Coding Interviews (C/C++Java/Python) Learn Algorithm Data Structures,Up Degree,4.0,12.5 total hours,62 lectures,Beginner
https://www.udemy.com/course/java-se-programming/,Learn JAVA Programming - Beginner to Master,Deep Dive in Core Java programming -Standard Edition. A Practical approach to learn Java. Become a Java Expert,Abdul Bari,4.7,61.5 total hours,333 lectures,All Levels
https://www.udemy.com/course/data-structure-using-c-programming-with-hands-on-project/,Data Structure  Using C Programming With Hands On Project,These course is all about basic concepts of a data structure including explaination from scratch.,"Sonal Palve, Sakshi Kakde",3.8,7 total hours,19 lectures,Beginner
https://www.udemy.com/course/pass-your-coding-interview-efficiently-with-cpp/,Pass Your Coding Interview Efficiently With C++,Concise and goal-oriented course designed to help you pass the coding interview.,Mor Mordoch,4.4,8.5 total hours,70 lectures,Intermediate
https://www.udemy.com/course/javascript-datastructures/,Data Structures in JavaScript: Master The Fundamentals,Learn the fundamentals of computer programming using JavaScript data structures,"Eduonix Learning Solutions, Eduonix-Tech .",4.6,14 total hours,88 lectures,All Levels
https://www.udemy.com/course/algorithmic-problems-in-java/,"Recursion, Backtracking and Dynamic Programming in Java","Algorithmic Problems in Java with Common Interview Questions (Recursion, Backtracking and Divide and Conquer Algorithms)",Holczer Balazs,4.6,10 total hours,108 lectures,All Levels
