url,Course Title,Course Headline,Instructor,Rating,course_length,number_of_lectures,difficulty
https://www.udemy.com/course/beg-modern-cpp/,Complete Modern C++ (C++11/14/17),"Learn about move semantics, lambda expressions, smart pointers, concurrency, template, STL & more",Umar Lone,4.5,20 total hours,232 lectures,All Levels
https://www.udemy.com/course/11-essential-coding-interview-questions/,11 Essential Coding Interview Questions + Coding Exercises!,Learn 3 handy problem solving techniques. Get 11 hand-picked problems. Get ready for your next coding interview!,YK Sugi,4.6,2 total hours,35 lectures,Intermediate
https://www.udemy.com/course/must-know-coding-interview-problems-python-data-structures/,9 Must know coding interview problems Data Structures,"Practice 9 must-know commonly asked  Coding Interview problems on hash-tables, heaps, queues, stacks, graphs and more",Eden Marco,4.5,2 total hours,16 lectures,Intermediate
https://www.udemy.com/course/master-cpp-byteboard/,Master C++ Programming From Beginner To Advance - C++ Course,"Lectures + Practical Hand-on C++ Course, Most Detailed Explanation of File Handling & STL, **190+ videos, **3 Projects",ByteBoard - VeDinesh Academy,4.5,15.5 total hours,193 lectures,All Levels
https://www.udemy.com/course/how-to-perform-umrah/,How To Perform Umrah - Learn Complete UMRAH  - ISLAM QURAN,How To Perform Umrah Video Course For Men And Women. Everything You Need To Know - UMRAH In Just 1 Course - ISLAM QURAN,Shahzeb Hussain,4.8,1.5 total hours,35 lectures,Beginner
https://www.udemy.com/course/design-and-analyzing-of-an-algorithm/,Design and Analysis of an Algorithm,In a smart way,"Monesh Venkul Vommi, Hemanth Yeluru",3.6,5 total hours,26 lectures,All Levels
https://www.udemy.com/course/introduction-to-python-data-structures-for-beginners/,Introduction to Python Data Structures for beginners,Learn about built-in structures used to hold data together in Python,Bluelime Learning Solutions,4.2,2 total hours,18 lectures,Beginner
https://www.udemy.com/course/datastructuresinc/,Datastructures in C Programming,Collection of Concepts - Datastructures in C PROGRAMMING Language,DIGIFLAX E-LEARNING,4.4,1.5 total hours,20 lectures,All Levels
https://www.udemy.com/course/javascript-marathon-interview-questions-series/,JavaScript - Marathon Interview Questions Series 2021,The Quintessential Guide For Cracking JavaScript Interviews For Developers World-wide,Nirmal Joshi,4.8,12.5 total hours,89 lectures,All Levels
https://www.udemy.com/course/recursion-in-python-and-c/,Learn All About Recursion in Python and C++,Learn Recursion Methods with Coding Exercises in Python and C++ for Smart Coding.,"Mubashir Hassan | 85,000+ enrollments worldwide",4.5,2 total hours,77 lectures,All Levels
https://www.udemy.com/course/50-problems/,50 popular coding interview problems,Prepare for your coding interview with these 50 solved and explained popular coding problems,Inside Code,4.8,8.5 total hours,101 lectures,Intermediate
https://www.udemy.com/course/cplusplus-programming-step-by-step/,C++ programming step-by-step: From Beginner to Advanced,"Start with basics of C++ (v11 and v14) then master File I/O, Object Oriented Programming or OOP, STL, Functors, Lambda",Shibaji Paul,4.2,27.5 total hours,190 lectures,All Levels
https://www.udemy.com/course/binary-trees-crash-course/,Binary Trees - Crash Course,Learn how to implement and how to solve problems on Binary Tree in the simplest way!,Sujithkumar MA,4.4,5 total hours,31 lectures,All Levels
https://www.udemy.com/course/data-structures-f/,Data Structures(Tests),"stacks,queues,Searching Algorithms,Sorting Algorithms,Graphs",Abira Jeoffrey,4.0,45 questions,All Levels,All Levels
https://www.udemy.com/course/analysis-of-algorithms/,Analysis of Algorithms,Be an EXPERT in analysing Algorithms & boost your Software career,Tanmay Varshney,3.7,4 total hours,34 lectures,All Levels
https://www.udemy.com/course/cpp-4skills/,Mastering 4 critical SKILLS using C++ 17,170 problems to enhance problem-solving skills. 6 projects for Project Building and Design Skills. High-quality quizzes,Dr. Mostafa Saad Ibrahim,4.6,32.5 total hours,363 lectures,All Levels
https://www.udemy.com/course/design-and-analysis-of-algorithms/,Design and Analysis of Algorithms,Fundamentals of Computer Algorithms.,shravan Kumar Manthri,4.3,10 total hours,37 lectures,All Levels
https://www.udemy.com/course/c-data-structures-basic-to-advanced/,Programming using C & Data Structures from Basic to Advanced,Learn C & Data Structures - Every module feature demonstrated with real-time examples,Sandeep Soni,4.0,25.5 total hours,72 lectures,Beginner
https://www.udemy.com/course/algorithms-an-intro-course-in-algorithms-coded-in-python/,Algorithms - An Intro Course in Algorithms coded in Python,Hatch as Expert in Algorithms through clear Python Algorithmic implementations and practical algorithm application,Dhruv Bais,3.2,2 total hours,26 lectures,Beginner
https://www.udemy.com/course/learn-cpp-from-interview-questions/,Learn C++ From Interview Questions,C++,Satish Venkatesh,3.4,8 total hours,121 lectures,All Levels
https://www.udemy.com/course/learn-c-from-zero-to-mastery/,Learn C++ Programming from Zero to Mastery in 2021,Specially designed for BEGINNERS who don't have any knowledge about programming & want to learn C++ from scratch in 2021,"Ankit Thakran, Harsh Kajla, Jatin Hooda",4.5,36 total hours,160 lectures,All Levels
https://www.udemy.com/course/javascript-algorithms/,JavaScript Algorithms,Learning to Solve JavaScript Algorithms as a JavaScript Newbie,Rob Merrill,4.8,6.5 total hours,82 lectures,Beginner
https://www.udemy.com/course/leetcode-with-javascript-coding-interview-guide/,LeetCode with JavaScript and Data Structures [2021],Learn techniques to solve those coding interview problems so you can land that dream job! [ LeetCode and HackerRank ],Shan A. (Google Tech Lead),3.7,1 total hour,5 lectures,Beginner
https://www.udemy.com/course/c-programming-made-easy-a-concise-c-course/,C++ Programming MADE EASY : A Concise C++ Course,A complete beginner's guide to learn C++ from scratch. Learn to write your own code.,Abdul Motin,3.3,42 total mins,6 lectures,All Levels
https://www.udemy.com/course/algorithm-design-techniques-live-problem-solving-in-java/,Algorithms in Java :Live problem solving & Design Techniques,"Recursion,BackTracking,Divide & Conquer,Dynamic Programming,Greedy Algorithms via Data Structures and Algorithms in Java",Basics Strong,4.0,19.5 total hours,167 lectures,All Levels
https://www.udemy.com/course/the-c-programming-language/,The C++ Programming Language Interview Questions and Answer,Top Questions on C++ Programming,Handson System,3.0,100 questions,All Levels,All Levels
https://www.udemy.com/course/learn-recursion/,Recursion,A detailed course that covers all what you need to know to be comfortable with recursion and not be afraid of it anymore,Inside Code,5.0,5 total hours,44 lectures,Beginner
https://www.udemy.com/course/algorithm-analaysis-and-data-structures-interview-guide-o/,Algorithm Analaysis-Interview Guide,Test Series in Algorithm Analysis,Suprio Dutta,5.0,110 questions,All Levels,Beginner
https://www.udemy.com/course/mastering-c-standard-library-features/,Mastering C++ Standard Library Features,Harness the power of the C++ STL and make full use of its components,Packt Publishing,4.9,6 total hours,28 lectures,Intermediate
https://www.udemy.com/course/learn-cpp-programming-language/,C++ Programming Bootcamp - Learn Complete C++  From 0 to 100,Start Your Coding Journey by Learning C++ Programming Language  From  Basic To Advance Level,Piroz Amin,4.2,9 total hours,105 lectures,All Levels
https://www.udemy.com/course/sorting-and-searching-algorithms/,Byte-Sized-Chunks: Sorting and Searching Algorithms,A visual way to master basic algorithms for strong fundamentals!,Loony Corn,4.9,3.5 total hours,14 lectures,All Levels
https://www.udemy.com/course/algorithms-complexity/,Complete Algorithms Complexity and Big O Notation Course,From beginner to professional in 2 hours!,Cronis Academy,4.4,2 total hours,16 lectures,All Levels
https://www.udemy.com/course/ultimate-javascript-leetcode-interview-bootcamp/,JavaScript & LeetCode | The Interview Bootcamp,Learn *all* the best practical tricks/techniques to solve those pesky interview problems so you can land that dream job!,Kevin Nguyen,4.6,5 total hours,66 lectures,All Levels
https://www.udemy.com/course/advanced-interviewer-training/,"INTERVIEW TRAINING: Ask Better Questions, Hire Better People","If you want to improve your hiring accuracy or transform the way your company interviews talent, this course is for you.",James Colino,4.5,1.5 total hours,19 lectures,All Levels
https://www.udemy.com/course/learn-intermediate-modern-c/,Learn Advanced Modern C++!,Take your knowledge of C++ to the next level!,James Raynard,4.3,15.5 total hours,118 lectures,Intermediate
https://www.udemy.com/course/c-standard-template-library-in-practice/,C++ Standard Template Library in Practice,Gain insights into the C++ STL using real-world examples,Packt Publishing,4.6,10.5 total hours,96 lectures,Intermediate
https://www.udemy.com/course/searching-and-sorting-algorithms-in-c/,Searching and Sorting Algorithms in C++,Data Searching and Data Sorting Techniques in C++,Temel Gunaydin,,3.5 total hours,14 lectures,All Levels
https://www.udemy.com/course/game-theory-algorithms-in-competitive-programming-course/,Game Theory Algorithms in Competitive Programming (2021),"Dive deep into game theory algorithms, learn & apply these techniques for Codeforces & Competitive Programming problems!","Apaar Kamal, Coding Minutes",4.6,7 total hours,35 lectures,All Levels
https://www.udemy.com/course/fundamentals-of-data-structures/,Fundamentals of Data Structures,Fundamentals of Data Structures and Algorithms Using C,Gangadhar Baburao Katkade,,3 total hours,6 lectures,Intermediate
https://www.udemy.com/course/data-structures-basics-c/,Data Structures Basics,Basics of Data Structures,Vaibhav Kashyap,,90 questions,Beginner,Intermediate
https://www.udemy.com/course/interview-questions-job-applicant/,Interview Questions: Interview Like a Professional HRM,A Quick Guide for Owners and Managers of Small Businesses,Eric Alagan,4.3,1 total hour,12 lectures,Beginner
https://www.udemy.com/course/become-a-skilled-python-programmer-sorting-and-searching/,Master Sort & Search Algorithms - Learn it Easy with Python,Sorting & Searching Made Easy - Programs manages more and more data and requires faster access - Avoid making mistakes,Rune Thomsen,4.9,4 total hours,34 lectures,All Levels
https://www.udemy.com/course/data-structures-computer-science-course-for-beginners/,Data Structures - Computer Science Course For Beginners,Understand the Theory of Datastructures,Jovan Kostic,,3 total hours,31 lectures,Intermediate
https://www.udemy.com/course/basics-of-data-structure-using-c/,Basics of Data structure using C,Basic concepts of Data structure,"Chetashri bhusari, Shonal Vaz, Supriya Kadam",,3.5 total hours,18 lectures,Beginner
https://www.udemy.com/course/break-away-coding-interviews-1/,Break Away: Programming And Coding Interviews,"A course that teaches pointers, linked lists, general programming, algorithms and recursion like no one else",Loony Corn,4.3,20 total hours,84 lectures,All Levels
https://www.udemy.com/course/beat-the-codility-coding-interview-in-python/,Beat the Codility Coding Interview in Python,Learn and practice how to solve many coding puzzles from Codility using Python.,James Cutajar,4.5,6.5 total hours,93 lectures,All Levels
https://www.udemy.com/course/100-algorithms-challenge/,100 Algorithms Challenge,How to Ace the JavaScript Coding Interview,Dylan Israel,4.2,8 total hours,122 lectures,All Levels
https://www.udemy.com/course/java-sorting-algorithms-for-newbs/,Java Sorting Algorithms for Newbs,Scared of algorithms? Fear no longer as you learn how to implement various non-threatening sorting algorithms.,Brendan Campbell,4.8,1 total hour,8 lectures,Intermediate
https://www.udemy.com/course/coding-interview-questions-complex-algorithms/,"Graph Algorithms - Coding interview questions, coronavirus","Practice complex Coding Interview problems on Graph Algorithms, Graph Theory, Dynamic Programming and more",Eden Marco,3.8,3.5 total hours,29 lectures,Intermediate
https://www.udemy.com/course/cpp-standard-template-library-stl-based-on-problem-solving/,C++ Standard Template Library(STL)  ( Incomplete course ),Learn almost everything of C++ Standard Template Library(STL)  Based on Problem solving. And become beginner to pro.,Muhammad Shahriar,4.4,3 total hours,18 lectures,Beginner
https://www.udemy.com/course/hindi-programming-interviews/,कीजिये तैयारी Programming & Coding Interviews की,"A course that teaches pointers, linked lists, general programming, algorithms and recursion like no one else",Loony Corn,4.6,20.5 total hours,82 lectures,All Levels
https://www.udemy.com/course/python-programming-beginners-bootcamp/,Python Programming Master Course (2021),"Hone your programming skills by learning Python3 - master data structures, OOPS, problem solving and project building!","Mohit Uniyal, Prateek Narang, Coding Minutes",4.6,20 total hours,191 lectures,Beginner
https://www.udemy.com/course/amazing-graph-algorithms-coding-in-javajavascript-python/,"Amazing Graph Algorithms : Coding in Java,JavaScript, Python","Graph Data Structure, DFS, BFS, Minimum Spanning Tree, Shortest Path, Network Flow, Strongly Connected Components",Basics Strong,4.7,9 total hours,68 lectures,All Levels
https://www.udemy.com/course/learn-c-from-scratch-to-advanced/,Learn C++ from Scratch to Advanced,C++ Programming Course,Umair Khan,4.7,26 total hours,165 lectures,Beginner
https://www.udemy.com/course/java-graph-algorithms-for-newbies/,Java Graph Algorithms for Newbs,Go from Zero to Hero in Graph Algorithms,Manoranjan Kumar,4.6,2.5 total hours,20 lectures,All Levels
https://www.udemy.com/course/complexity-analysis/,Time and space complexity analysis (big-O notation),Learn how to analyze the time complexity and the space complexity of an algorithm by using the big O notation,Inside Code,4.4,7.5 total hours,57 lectures,Beginner
https://www.udemy.com/course/cplusplus-75-solved-problems/,Learn By Example: C++ Programming - 75 Solved Problems,"C++ will never seem intimidating again, once you're done with these examples.",Loony Corn,4.3,16 total hours,87 lectures,All Levels
https://www.udemy.com/course/c-plus-plus-mcq-practice-questions/,C++ MCQ Practice Questions,Examination Preparation and Interview questions on C++,Manu Mitra,1.3,239 questions,All Levels,All Levels
https://www.udemy.com/course/pointers-and-references-explained-c/,Pointers and References explained! (C/C++),Comprehensive course covering pointers and references from scratch up to the most advanced topics,Mor Mordoch,4.8,3.5 total hours,29 lectures,All Levels
https://www.udemy.com/course/python-searching-sorting-algorithms/,Python Searching & Sorting Algorithms - A Practical Approach,Implement searching and sorting Algorithms in Python and learn how they work through engaging animations and projects.,Estefania Cassingena Navone,4.4,7 total hours,124 lectures,All Levels
https://www.udemy.com/course/learn-data-structures-like-engineers-do/,Data Structures For Machine Learning |Complete Online Course,"Learn ,design and code DATA STRUCTURES for your Machine Learning and AI projects with this first of its kind course !",Mohamed Elatoubi,4.9,5 total hours,55 lectures,Beginner
https://www.udemy.com/course/update-to-modern-cplusplus/,Update to Modern C++!,Refresh and update your C++ skills!,James Raynard,4.7,11.5 total hours,99 lectures,Intermediate
https://www.udemy.com/course/byte-sized-chunks-graph-algorithms-and-problems-in-java/,Byte-Sized-Chunks: Graph Algorithms and Problems in Java,"Djisktra, Prim, Kruskal, Bellman-Ford, the topological sort - all will make sense now!",Loony Corn,4.6,5 total hours,28 lectures,Intermediate
https://www.udemy.com/course/learn-c-smart-pointers-in-30-minutes/,Master C++ Pointers and Smart Pointers,"pointers, shared_ptr, unique_ptr and weak_ptr in C++",Abhishek Kumar,4.0,1.5 total hours,16 lectures,Intermediate
https://www.udemy.com/course/demystifying-templates-in-cpp/,Demystifying Templates in C++,"Illuminating neglected, misunderstood, and misused shades of Templates in C++","Bhalchandra Gholkar, Daryl Newell",4.1,2 total hours,21 lectures,Intermediate
https://www.udemy.com/course/algorithm-analysis/,Introduction to Algorithm Analysis [For Complete Beginners],"Understand and solve algorithms using Big O, Big Omega, and Theta time complexity.",Rodney Anderson,3.4,1.5 total hours,21 lectures,All Levels
https://www.udemy.com/course/algorithms-in-javascript-cracking-coding-interviews/,Algorithms in JavaScript - Cracking Coding Interviews,Learn to implement real world algorithms in JavaScript and ace your technical interviews,"Eduonix Learning Solutions, Eduonix-Tech ., Samy Eduonix",3.6,6 total hours,58 lectures,Beginner
https://www.udemy.com/course/crash-course-on-cpp-stl/,Crash Course on C++ Standard Template Library (STL),First step to master Data structures.,Harshit Jain,3.9,2.5 total hours,24 lectures,Beginner
https://www.udemy.com/course/the-bible-of-algorithms-and-interview-questions/,The Bible of Competitive Programming,Build the foundation in Algorithms and Data Structures to ace Competitive Programming,Andrei Chiriac,4.4,15 total hours,112 lectures,All Levels
https://www.udemy.com/course/searching-sorting-algorithms/,Searching & Sorting Algorithms,Learn to develop and understand Searching & Sorting Algorithms,"Academy of Computing & Artificial Intelligence, Future AI  - Academy of Computing & Artificial Intelligence, Pragmatic Programming",4.0,2 total hours,35 lectures,Beginner
https://www.udemy.com/course/c-and-c-programming/,C and C++ Programming : Step-by-Step Tutorial,C Programming and C++ Programming Learn both at your own pace,DoEdu IT Educations,3.7,12 total hours,142 lectures,Beginner
https://www.udemy.com/course/cracking-coding-interviews-mastering-algorithms/,Cracking Coding Interviews - Mastering Algorithms,"Ace your next Google, Facebook, Amazon, Airbnb, Uber interviews and learn all the tricks to solve algorithm problems",Christopher Chang,3.6,3 total hours,24 lectures,All Levels
https://www.udemy.com/course/beat-the-codility-coding-interview-in-java/,Beat the Codility Coding Interview in Java,Learn and practice how to solve many coding puzzles from Codility using Java,James Cutajar,4.6,6.5 total hours,93 lectures,All Levels
https://www.udemy.com/course/coding-interview-cram-must-know-algorithms-and-questions/,Coding Interview Cram: Must Know Algorithms and Questions,Ace your next Kotlin coding interview by mastering data structures and algorithms.,"Mammoth Interactive, John Bura",4.6,4.5 total hours,41 lectures,Beginner
https://www.udemy.com/course/ultimate-javascript-interview-course/,Ultimate JavaScript Interview Course,"Prepare for you next JavaScript interview by learning Data Structures, Algorithms, and Interview Questions.",Eric Traub,4.4,11 total hours,243 lectures,All Levels
https://www.udemy.com/course/python-data-science-master-course/,Python for Data Science Master Course (2021),"Level up in Data Science using Python, master Numpy, Pandas, Data Visualisation, Web Scraping, Automation, SQL & more!","Mohit Uniyal, Coding Minutes",4.6,22.5 total hours,161 lectures,All Levels
https://www.udemy.com/course/learn-cpp-quickly-without-any-prior-programming-knowledge/,Learn C++ Quickly without any prior programming knowledge,"Stuck thinking, what Programming Language should I learn first? C++ allows you to learn programming from the ground up.",Hunter Reid,4.3,1.5 total hours,31 lectures,Beginner
https://www.udemy.com/course/big-o-notation-data-structures-and-algorithms/,"""Big O notation"" Data Structures and Algorithms- 2021 Update","""A to Z"" Data Structures and Algorithms.",Rakibul Hasan Khan,,1.5 total hours,5 lectures,Beginner
https://www.udemy.com/course/stacks-queues-binary-trees-heaps/,"Byte-Sized-Chunks: Stacks, Queues, Binary Trees, Heaps",A visual way to master basic data structures for strong fundamentals!,Loony Corn,5.0,5.5 total hours,23 lectures,All Levels
https://www.udemy.com/course/c-and-cpp-bootcamp/,Learn C and C++ Bootcamp for Beginners,Master the C and C++ programming language with easy to understand examples,EDUmobile Academy,4.3,5 total hours,45 lectures,All Levels
https://www.udemy.com/course/20-essential-data-structures-coding-interview-questions-in-java-python/,20 Essential Coding Interview Questions in Java and Python,"Learn Data Structure & Algorithm technical coding questions asked at GAFA. Array, HashMap, LinkedList, Tree, Recursion.",CS Career Kaizen (元Microsoft現シリバレエンジニア),4.7,5 total hours,182 lectures,Beginner
https://www.udemy.com/course/algorithms-in-python-design-techniques/,Algorithms in Python : Design Techniques And Approach,"BackTracking,Divide & Conquer,Dynamic Programming,Greedy Algorithms via Data Structures for Interview & problem solving",Basics Strong,4.0,17.5 total hours,158 lectures,All Levels
https://www.udemy.com/course/complete-coding-interview-preparation-masterclass/,Complete Coding Interview Preparation Masterclass,Learn problem solving with data structures and algorithms for cracking interviews of top product based companies,Pratik Singhal,5.0,23 total hours,132 lectures,Beginner
https://www.udemy.com/course/learn-graph-algorithms-with-cpp-programming/,Graph Theory and Algorithms Implementation,"Implement Graphs important Algorithms like DFS, BFS, Kruskals ,Prims and Dijastra's Algorithms in C++",Kunal Gupta,,4.5 total hours,19 lectures,All Levels
https://www.udemy.com/course/demystifying-containers-in-stl-in-cpp/,Demystifying Containers in STL in C++,Let's explore the magical world of STL containers,"Bhalchandra Gholkar, Daryl Newell",3.6,3 total hours,17 lectures,Intermediate
https://www.udemy.com/course/master-c-standard-template-library-stl/,Master C++ Standard Template Library (STL),"Master the power of C++ of STL and write code quickly, efficiently and in a generic manner.",Abhishek Kumar,3.3,4 total hours,19 lectures,All Levels
https://www.udemy.com/course/100-leetcode-algorithm-questions-for-technical-interview/,100 Leetcode Challenge - Coding Interview[2021],"Learn Data Structures and Algorithms, and prepare interviews for FAANG companies like G",Zhengquan Chen,4.5,12 total hours,100 lectures,Beginner
https://www.udemy.com/course/coding-interview-crash-course-for-web-developer-2020/,LeetCode & JavaScript Complete Course for Web Developer 2021,Ace your JavaScript Interviews by learning DS and Algorithm. LeetCode + HackerRank + coderpad Binary Search Tree,Shan A. (Google Tech Lead),4.1,3 total hours,18 lectures,All Levels
https://www.udemy.com/course/complete-javascript-coding-interview-questions-masterclass/,Complete JavaScript Coding Interview Questions Masterclass,Algorithms and Data Structures: 30+ Most Popular Interview Questions Challenge,"Mammoth Interactive, John Bura",4.3,7 total hours,57 lectures,Beginner
https://www.udemy.com/course/introduction-to-algorithms-in-javascript/,Introduction to Algorithms in Javascript.,Thinking of Starting Development in Javascript? Checkout this interactive course that takes you from start to the end.,Harkirat Singh,3.5,2 total hours,18 lectures,Beginner
https://www.udemy.com/course/sorting-techniques-with-programs-and-execution/,Sorting Techniques with programs and execution,Design and analysis,shravan Kumar Manthri,,4.5 total hours,11 lectures,Intermediate
https://www.udemy.com/course/modern-cpp-memory-management-learn-to-write-good-code-fast/,Modern C++ Memory Management: Learn to write good code fast,Using the power of C++11 to efficiently write reliable software,Mattias Johansson,4.6,2 total hours,20 lectures,Beginner
https://www.udemy.com/course/dynamic-programming-i/,Dynamic Programming - I,Master the art of solving Dynamic Programming problems and acing the Coding Interviews,Sweet Codey,4.5,2.5 total hours,13 lectures,All Levels
https://www.udemy.com/course/the-road-to-dynamic-programming/,"The Road To Dynamic Programming: Java, JavaScript, & Python","Recursion, Memoization, and Tabulation in Dynamic Programming",Hadi youness,4.7,5.5 total hours,42 lectures,All Levels
https://www.udemy.com/course/cpp-pointers/,C/C++ Pointers & Applications,"Learn the applications of pointers such as usage in dynamic arrays, linked lists, function pointers, callbacks, etc",Umar Lone,3.9,7 total hours,81 lectures,Intermediate
https://www.udemy.com/course/mastering-coding-interviews-and-competitions/,Mastering Coding Interviews & Competitions,Problems & Solutions to Easy/Medium/Hard Coding Interview Problems,AlgoSTEM Inc.,4.0,2 total hours,27 lectures,Intermediate
https://www.udemy.com/course/classic-coding-algorithms-searching-and-sorting/,Classic Coding Algorithms: Searching and Sorting,A thorough refresher on common algorithms to take before your next coding interview.,Edaqa Mortoray,,2 total hours,31 lectures,All Levels
https://www.udemy.com/course/algorithm-design-and-analysis/,Algorithm Design Techniques  From beginner to advanced (DAA),Divide and Conquer | Dynamic Programming | Greedy | Back Tracking | Branch & bound | Algorithm Design and Analyse,Jithin Parakka,3.4,8.5 total hours,102 lectures,Intermediate
https://www.udemy.com/course/coding-interview-questions-python-edition/,Essential Coding Interview Questions Python Edition,ARE YOU WANTING TO GET THAT DREAM JOB OR PAY-RISE YOU DESERVE? THIS COURSE IS DESIGNED FOR YOU!,Nathan Clarke,4.1,2 total hours,40 lectures,Intermediate
https://www.udemy.com/course/recursion-for-programmers/,Recursion For Programmers,"Algorithms and Data Structures: Recursion, the Stack and Trees",Huw Collingbourne,4.5,2 total hours,31 lectures,Intermediate
